{
  "protocolVersion": "viewer.review.usage/1",
  "declarationId": "00000000-0000-4000-8000-000000000801",
  "projectId": "00000000-0000-4000-8000-000000000001",
  "reviewStreamId": "00000000-0000-4000-8000-000000000101",
  "basis": {
    "snapshotId": "00000000-0000-4000-8000-000000000501",
    "blake3": "5050505050505050505050505050505050505050505050505050505050505050"
  },
  "targets": [
    {
      "feedbackId": "00000000-0000-4000-8000-000000000401",
      "textRevisionId": "00000000-0000-4000-8000-000000000402",
      "targetId": "00000000-0000-4000-8000-000000000411",
      "targetRevisionId": "00000000-0000-4000-8000-000000000421"
    }
  ],
  "outputs": []
}
